{
  "$schema": "./recipe.schema.json",
  "name": "cursor",
  "variables": {
    "advisor_delivery": "agent",
    "agent_mode": false,
    "agent_models": false,
    "agent_name_prefix": "",
    "agent_ns": "",
    "agent_tools": false,
    "agents_readonly": true,
    "command_agent": false,
    "command_disable_invocation": false,
    "command_format": "frontmatter",
    "command_name": true,
    "command_name_prefix": "",
    "command_title": "none",
    "command_wide_gap": false,
    "forced_subagent": "no",
    "host": "Cursor",
    "instructions_file": "AGENTS.md",
    "lead_edit_block": "none",
    "model_high": false,
    "model_low": false,
    "model_medium": false,
    "ns": "/",
    "persona_frontmatter": true,
    "plan_enter": "plan mode",
    "plan_exit": "approval",
    "plan_mode": "prose",
    "plugin_manifest_dir": ".cursor-plugin/",
    "plugin_root": "${CURSOR_PLUGIN_ROOT}/",
    "product": "Cursor",
    "version_manifest": "plugin_folder",
    "write_backstop": "notify_only"
  },
  "runtime_variables": [
    "CURSOR_PLUGIN_ROOT"
  ],
  "targets": {
    ".cursor-plugin/plugin.json": {
      "sources": [
        "src/content/targets/cursor/.cursor-plugin/plugin.json"
      ]
    },
    "CAPABILITIES.md": {
      "sources": [
        "src/content/targets/cursor/CAPABILITIES.md"
      ]
    },
    "README.md": {
      "sources": [
        "src/content/targets/cursor/README.md"
      ]
    },
    "agents/backend-engineer.md": {
      "sources": [
        "src/content/agents/backend-engineer.md"
      ]
    },
    "agents/builder.md": {
      "sources": [
        "src/content/agents/builder.md"
      ]
    },
    "agents/business-analyst.md": {
      "sources": [
        "src/content/agents/business-analyst.md"
      ]
    },
    "agents/challenger.md": {
      "sources": [
        "src/content/agents/challenger.md"
      ]
    },
    "agents/copywriter.md": {
      "sources": [
        "src/content/agents/copywriter.md"
      ]
    },
    "agents/cynical-reviewer.md": {
      "sources": [
        "src/content/agents/cynical-reviewer.md"
      ]
    },
    "agents/devops-engineer.md": {
      "sources": [
        "src/content/agents/devops-engineer.md"
      ]
    },
    "agents/document-specialist.md": {
      "sources": [
        "src/content/agents/document-specialist.md"
      ]
    },
    "agents/frontend-engineer.md": {
      "sources": [
        "src/content/agents/frontend-engineer.md"
      ]
    },
    "agents/hercules.md": {
      "sources": [
        "src/content/agents/hercules.md"
      ]
    },
    "agents/lead-architect.md": {
      "sources": [
        "src/content/agents/lead-architect.md"
      ]
    },
    "agents/maintainer.md": {
      "sources": [
        "src/content/agents/maintainer.md"
      ]
    },
    "agents/security-expert.md": {
      "sources": [
        "src/content/agents/security-expert.md"
      ]
    },
    "agents/senior-qa-engineer.md": {
      "sources": [
        "src/content/agents/senior-qa-engineer.md"
      ]
    },
    "agents/simplicity-advocate.md": {
      "sources": [
        "src/content/agents/simplicity-advocate.md"
      ]
    },
    "agents/source-checker.md": {
      "sources": [
        "src/content/agents/source-checker.md"
      ]
    },
    "agents/ux-ui-designer.md": {
      "sources": [
        "src/content/agents/ux-ui-designer.md"
      ]
    },
    "commands/build.md": {
      "sources": [
        "src/content/commands/build.md"
      ]
    },
    "commands/design.md": {
      "sources": [
        "src/content/commands/design.md"
      ]
    },
    "commands/discover.md": {
      "sources": [
        "src/content/commands/discover.md"
      ]
    },
    "commands/project-reset.md": {
      "sources": [
        "src/content/commands/project-reset.md"
      ]
    },
    "commands/ship.md": {
      "sources": [
        "src/content/commands/ship.md"
      ]
    },
    "commands/workflow.md": {
      "sources": [
        "src/content/commands/workflow.md"
      ]
    },
    "hooks/frozen_tests.py": {
      "sources": [
        "src/scripts/hooks/frozen_tests.py"
      ]
    },
    "hooks/hercules_gate.py": {
      "sources": [
        "src/scripts/hooks/hercules_gate.py"
      ]
    },
    "hooks/hercules_state.py": {
      "sources": [
        "src/scripts/hooks/hercules_state.py"
      ]
    },
    "hooks/hooks.json": {
      "sources": [
        "src/content/targets/cursor/hooks/hooks.json"
      ]
    },
    "hooks/write_gate.json": {
      "sources": [
        "src/content/targets/cursor/hooks/write_gate.json"
      ]
    },
    "logo.svg": {
      "sources": [
        "src/content/targets/cursor/logo.svg"
      ]
    },
    "protocols/a2a-communication-protocol.md": {
      "sources": [
        "src/content/protocols/a2a-communication-protocol.md"
      ]
    },
    "protocols/debate-consensus-protocol.md": {
      "sources": [
        "src/content/protocols/debate-consensus-protocol.md"
      ]
    },
    "protocols/workflow-protocol.md": {
      "sources": [
        "src/content/protocols/workflow-protocol.md"
      ]
    },
    "rules/hercules-persona.mdc": {
      "sources": [
        "src/content/persona.md"
      ]
    },
    "skills/code-of-conduct-generator/SKILL.md": {
      "sources": [
        "src/content/skills/code-of-conduct-generator/SKILL.md"
      ]
    },
    "skills/code-of-conduct-generator/coverage-map.md": {
      "sources": [
        "src/content/skills/code-of-conduct-generator/coverage-map.md"
      ]
    },
    "skills/fusion-setup/SKILL.md": {
      "sources": [
        "src/content/skills/fusion-setup/SKILL.md"
      ]
    },
    "skills/hercules-reference/SKILL.md": {
      "sources": [
        "src/content/skills/hercules-reference/SKILL.md"
      ]
    },
    "skills/learnings/SKILL.md": {
      "sources": [
        "src/content/skills/learnings/SKILL.md"
      ]
    },
    "skills/write-test-scenarios/SKILL.md": {
      "sources": [
        "src/content/skills/write-test-scenarios/SKILL.md"
      ]
    },
    "tools/project_reset.py": {
      "sources": [
        "src/scripts/tools/project_reset.py"
      ]
    },
    "tools/registry_sync.py": {
      "sources": [
        "src/scripts/tools/registry_sync.py"
      ]
    },
    "tools/retire_spec.py": {
      "sources": [
        "src/scripts/tools/retire_spec.py"
      ]
    },
    "tools/state_patch.py": {
      "sources": [
        "src/scripts/tools/state_patch.py"
      ]
    }
  }
}
