{
  "$schema": "./recipe.schema.json",
  "name": "codex",
  "variables": {
    "advisor_delivery": "skill",
    "agent_mode": false,
    "agent_models": false,
    "agent_name_prefix": "hercules-advisor-",
    "agent_ns": "",
    "agent_tools": false,
    "agents_readonly": false,
    "command_agent": false,
    "command_disable_invocation": false,
    "command_format": "frontmatter",
    "command_name": true,
    "command_name_prefix": "hercules-",
    "command_title": "none",
    "command_wide_gap": false,
    "forced_subagent": "yes",
    "host": "Codex",
    "instructions_file": "AGENTS.md",
    "lead_edit_block": "none",
    "model_high": false,
    "model_low": false,
    "model_medium": false,
    "ns": "$hercules-",
    "persona_frontmatter": false,
    "plan_enter": "plan mode",
    "plan_exit": "approval",
    "plan_mode": "prose",
    "plugin_manifest_dir": false,
    "plugin_root": "${PLUGIN_ROOT}/",
    "product": "Codex",
    "version_manifest": false,
    "write_backstop": false
  },
  "runtime_variables": [
    "PLUGIN_ROOT"
  ],
  "targets": {
    ".codex-plugin/plugin.json": {
      "sources": [
        "src/content/targets/codex/.codex-plugin/plugin.json"
      ]
    },
    "AGENTS.md": {
      "sources": [
        "src/content/persona.md"
      ]
    },
    "CAPABILITIES.md": {
      "sources": [
        "src/content/targets/codex/CAPABILITIES.md"
      ]
    },
    "hooks/frozen_tests.py": {
      "sources": [
        "src/scripts/hooks/frozen_tests.py"
      ]
    },
    "hooks/hercules_gate.py": {
      "sources": [
        "src/scripts/hooks/hercules_gate.py"
      ]
    },
    "hooks/hercules_state.py": {
      "sources": [
        "src/scripts/hooks/hercules_state.py"
      ]
    },
    "hooks/hooks.json": {
      "sources": [
        "src/content/targets/codex/hooks/hooks.json"
      ]
    },
    "hooks/write_gate.json": {
      "sources": [
        "src/content/targets/codex/hooks/write_gate.json"
      ]
    },
    "protocols/a2a-communication-protocol.md": {
      "sources": [
        "src/content/protocols/a2a-communication-protocol.md"
      ]
    },
    "protocols/debate-consensus-protocol.md": {
      "sources": [
        "src/content/protocols/debate-consensus-protocol.md"
      ]
    },
    "protocols/workflow-protocol.md": {
      "sources": [
        "src/content/protocols/workflow-protocol.md"
      ]
    },
    "skills/code-of-conduct-generator/SKILL.md": {
      "sources": [
        "src/content/skills/code-of-conduct-generator/SKILL.md"
      ]
    },
    "skills/code-of-conduct-generator/coverage-map.md": {
      "sources": [
        "src/content/skills/code-of-conduct-generator/coverage-map.md"
      ]
    },
    "skills/fusion-setup/SKILL.md": {
      "sources": [
        "src/content/skills/fusion-setup/SKILL.md"
      ]
    },
    "skills/hercules-advisor-backend-engineer/SKILL.md": {
      "sources": [
        "src/content/agents/backend-engineer.md"
      ]
    },
    "skills/hercules-advisor-builder/SKILL.md": {
      "sources": [
        "src/content/agents/builder.md"
      ]
    },
    "skills/hercules-advisor-business-analyst/SKILL.md": {
      "sources": [
        "src/content/agents/business-analyst.md"
      ]
    },
    "skills/hercules-advisor-challenger/SKILL.md": {
      "sources": [
        "src/content/agents/challenger.md"
      ]
    },
    "skills/hercules-advisor-copywriter/SKILL.md": {
      "sources": [
        "src/content/agents/copywriter.md"
      ]
    },
    "skills/hercules-advisor-cynical-reviewer/SKILL.md": {
      "sources": [
        "src/content/agents/cynical-reviewer.md"
      ]
    },
    "skills/hercules-advisor-devops-engineer/SKILL.md": {
      "sources": [
        "src/content/agents/devops-engineer.md"
      ]
    },
    "skills/hercules-advisor-document-specialist/SKILL.md": {
      "sources": [
        "src/content/agents/document-specialist.md"
      ]
    },
    "skills/hercules-advisor-frontend-engineer/SKILL.md": {
      "sources": [
        "src/content/agents/frontend-engineer.md"
      ]
    },
    "skills/hercules-advisor-hercules/SKILL.md": {
      "sources": [
        "src/content/agents/hercules.md"
      ]
    },
    "skills/hercules-advisor-lead-architect/SKILL.md": {
      "sources": [
        "src/content/agents/lead-architect.md"
      ]
    },
    "skills/hercules-advisor-maintainer/SKILL.md": {
      "sources": [
        "src/content/agents/maintainer.md"
      ]
    },
    "skills/hercules-advisor-security-expert/SKILL.md": {
      "sources": [
        "src/content/agents/security-expert.md"
      ]
    },
    "skills/hercules-advisor-senior-qa-engineer/SKILL.md": {
      "sources": [
        "src/content/agents/senior-qa-engineer.md"
      ]
    },
    "skills/hercules-advisor-simplicity-advocate/SKILL.md": {
      "sources": [
        "src/content/agents/simplicity-advocate.md"
      ]
    },
    "skills/hercules-advisor-source-checker/SKILL.md": {
      "sources": [
        "src/content/agents/source-checker.md"
      ]
    },
    "skills/hercules-advisor-ux-ui-designer/SKILL.md": {
      "sources": [
        "src/content/agents/ux-ui-designer.md"
      ]
    },
    "skills/hercules-build/SKILL.md": {
      "sources": [
        "src/content/commands/build.md"
      ]
    },
    "skills/hercules-design/SKILL.md": {
      "sources": [
        "src/content/commands/design.md"
      ]
    },
    "skills/hercules-discover/SKILL.md": {
      "sources": [
        "src/content/commands/discover.md"
      ]
    },
    "skills/hercules-project-reset/SKILL.md": {
      "sources": [
        "src/content/commands/project-reset.md"
      ]
    },
    "skills/hercules-reference/SKILL.md": {
      "sources": [
        "src/content/skills/hercules-reference/SKILL.md"
      ]
    },
    "skills/hercules-ship/SKILL.md": {
      "sources": [
        "src/content/commands/ship.md"
      ]
    },
    "skills/hercules-workflow/SKILL.md": {
      "sources": [
        "src/content/commands/workflow.md"
      ]
    },
    "skills/learnings/SKILL.md": {
      "sources": [
        "src/content/skills/learnings/SKILL.md"
      ]
    },
    "skills/write-test-scenarios/SKILL.md": {
      "sources": [
        "src/content/skills/write-test-scenarios/SKILL.md"
      ]
    },
    "tools/code_of_conduct/coc_gate.py": {
      "sources": [
        "src/scripts/tools/code_of_conduct/coc_gate.py"
      ]
    },
    "tools/code_of_conduct/coc_lint.py": {
      "sources": [
        "src/scripts/tools/code_of_conduct/coc_lint.py"
      ]
    },
    "tools/code_of_conduct/coc_scan.py": {
      "sources": [
        "src/scripts/tools/code_of_conduct/coc_scan.py"
      ]
    },
    "tools/project_reset.py": {
      "sources": [
        "src/scripts/tools/project_reset.py"
      ]
    },
    "tools/registry_sync.py": {
      "sources": [
        "src/scripts/tools/registry_sync.py"
      ]
    },
    "tools/retire_spec.py": {
      "sources": [
        "src/scripts/tools/retire_spec.py"
      ]
    },
    "tools/state_patch.py": {
      "sources": [
        "src/scripts/tools/state_patch.py"
      ]
    }
  }
}
