{
  "$schema": "./recipe.schema.json",
  "name": "copilot-cli",
  "variables": {
    "advisor_delivery": "agent",
    "agent_mode": false,
    "agent_models": false,
    "agent_name_prefix": "",
    "agent_ns": "",
    "agent_tools": false,
    "agents_readonly": false,
    "command_agent": false,
    "command_disable_invocation": false,
    "command_format": "frontmatter",
    "command_name": false,
    "command_name_prefix": "",
    "command_title": "none",
    "command_wide_gap": false,
    "forced_subagent": "no",
    "host": "Copilot",
    "instructions_file": "AGENTS.md",
    "lead_edit_block": "none",
    "model_high": false,
    "model_low": false,
    "model_medium": false,
    "ns": "/",
    "persona_frontmatter": false,
    "plan_enter": "plan mode",
    "plan_exit": "approval",
    "plan_mode": "prose",
    "plugin_manifest_dir": false,
    "plugin_root": "${PLUGIN_ROOT}/",
    "product": "GitHub Copilot CLI",
    "version_manifest": false,
    "write_backstop": false
  },
  "runtime_variables": [
    "PLUGIN_ROOT"
  ],
  "targets": {
    ".github/plugin/marketplace.json": {
      "sources": [
        "src/content/targets/copilot-cli/.github/plugin/marketplace.json"
      ]
    },
    "AGENTS.md": {
      "sources": [
        "src/content/persona.md"
      ]
    },
    "CAPABILITIES.md": {
      "sources": [
        "src/content/targets/copilot-cli/CAPABILITIES.md"
      ]
    },
    "agents/backend-engineer.agent.md": {
      "sources": [
        "src/content/agents/backend-engineer.md"
      ]
    },
    "agents/builder.agent.md": {
      "sources": [
        "src/content/agents/builder.md"
      ]
    },
    "agents/business-analyst.agent.md": {
      "sources": [
        "src/content/agents/business-analyst.md"
      ]
    },
    "agents/challenger.agent.md": {
      "sources": [
        "src/content/agents/challenger.md"
      ]
    },
    "agents/copywriter.agent.md": {
      "sources": [
        "src/content/agents/copywriter.md"
      ]
    },
    "agents/cynical-reviewer.agent.md": {
      "sources": [
        "src/content/agents/cynical-reviewer.md"
      ]
    },
    "agents/devops-engineer.agent.md": {
      "sources": [
        "src/content/agents/devops-engineer.md"
      ]
    },
    "agents/document-specialist.agent.md": {
      "sources": [
        "src/content/agents/document-specialist.md"
      ]
    },
    "agents/frontend-engineer.agent.md": {
      "sources": [
        "src/content/agents/frontend-engineer.md"
      ]
    },
    "agents/hercules.agent.md": {
      "sources": [
        "src/content/agents/hercules.md"
      ]
    },
    "agents/lead-architect.agent.md": {
      "sources": [
        "src/content/agents/lead-architect.md"
      ]
    },
    "agents/maintainer.agent.md": {
      "sources": [
        "src/content/agents/maintainer.md"
      ]
    },
    "agents/security-expert.agent.md": {
      "sources": [
        "src/content/agents/security-expert.md"
      ]
    },
    "agents/senior-qa-engineer.agent.md": {
      "sources": [
        "src/content/agents/senior-qa-engineer.md"
      ]
    },
    "agents/simplicity-advocate.agent.md": {
      "sources": [
        "src/content/agents/simplicity-advocate.md"
      ]
    },
    "agents/source-checker.agent.md": {
      "sources": [
        "src/content/agents/source-checker.md"
      ]
    },
    "agents/ux-ui-designer.agent.md": {
      "sources": [
        "src/content/agents/ux-ui-designer.md"
      ]
    },
    "commands/build.prompt.md": {
      "sources": [
        "src/content/commands/build.md"
      ]
    },
    "commands/design.prompt.md": {
      "sources": [
        "src/content/commands/design.md"
      ]
    },
    "commands/discover.prompt.md": {
      "sources": [
        "src/content/commands/discover.md"
      ]
    },
    "commands/project-reset.prompt.md": {
      "sources": [
        "src/content/commands/project-reset.md"
      ]
    },
    "commands/ship.prompt.md": {
      "sources": [
        "src/content/commands/ship.md"
      ]
    },
    "commands/workflow.prompt.md": {
      "sources": [
        "src/content/commands/workflow.md"
      ]
    },
    "hooks/document_gate.py": {
      "sources": [
        "src/scripts/hooks/document_gate.py"
      ]
    },
    "hooks/frozen_tests.py": {
      "sources": [
        "src/scripts/hooks/frozen_tests.py"
      ]
    },
    "hooks/hercules_gate.py": {
      "sources": [
        "src/scripts/hooks/hercules_gate.py"
      ]
    },
    "hooks/hercules_state.py": {
      "sources": [
        "src/scripts/hooks/hercules_state.py"
      ]
    },
    "hooks/hooks.json": {
      "sources": [
        "src/content/targets/copilot-cli/hooks/hooks.json"
      ]
    },
    "hooks/write_gate.json": {
      "sources": [
        "src/content/targets/copilot-cli/hooks/write_gate.json"
      ]
    },
    "plugin.json": {
      "sources": [
        "src/content/targets/copilot-cli/plugin.json"
      ]
    },
    "protocols/a2a-communication-protocol.md": {
      "sources": [
        "src/content/protocols/a2a-communication-protocol.md"
      ]
    },
    "protocols/debate-consensus-protocol.md": {
      "sources": [
        "src/content/protocols/debate-consensus-protocol.md"
      ]
    },
    "protocols/workflow-protocol.md": {
      "sources": [
        "src/content/protocols/workflow-protocol.md"
      ]
    },
    "skills/code-of-conduct-generator/SKILL.md": {
      "sources": [
        "src/content/skills/code-of-conduct-generator/SKILL.md"
      ]
    },
    "skills/code-of-conduct-generator/coverage-map.md": {
      "sources": [
        "src/content/skills/code-of-conduct-generator/coverage-map.md"
      ]
    },
    "skills/document-contract/SKILL.md": {
      "sources": [
        "src/content/skills/document-contract/SKILL.md"
      ]
    },
    "skills/document-contract/requirements-contract.md": {
      "sources": [
        "src/content/skills/document-contract/requirements-contract.md"
      ]
    },
    "skills/document-contract/design-contract.md": {
      "sources": [
        "src/content/skills/document-contract/design-contract.md"
      ]
    },
    "skills/fusion-setup/SKILL.md": {
      "sources": [
        "src/content/skills/fusion-setup/SKILL.md"
      ]
    },
    "skills/hercules-reference/SKILL.md": {
      "sources": [
        "src/content/skills/hercules-reference/SKILL.md"
      ]
    },
    "skills/learnings/SKILL.md": {
      "sources": [
        "src/content/skills/learnings/SKILL.md"
      ]
    },
    "skills/write-test-scenarios/SKILL.md": {
      "sources": [
        "src/content/skills/write-test-scenarios/SKILL.md"
      ]
    },
    "tools/doc_lint.py": {
      "sources": [
        "src/scripts/tools/doc_lint.py"
      ]
    },
    "tools/doc_report.py": {
      "sources": [
        "src/scripts/tools/doc_report.py"
      ]
    },
    "tools/doc_rules.json": {
      "sources": [
        "src/scripts/tools/doc_rules.json"
      ]
    },
    "tools/project_reset.py": {
      "sources": [
        "src/scripts/tools/project_reset.py"
      ]
    },
    "tools/registry_sync.py": {
      "sources": [
        "src/scripts/tools/registry_sync.py"
      ]
    },
    "tools/retire_spec.py": {
      "sources": [
        "src/scripts/tools/retire_spec.py"
      ]
    },
    "tools/state_patch.py": {
      "sources": [
        "src/scripts/tools/state_patch.py"
      ]
    }
  }
}
